id,title,authors,journal,year,keywords,abstract
1,Deep Learning for Natural Language Processing,LeCun Y.; Bengio Y.,Journal of Machine Learning Research,2021,deep learning; NLP; neural networks; text classification,This paper explores the application of deep learning techniques in natural language processing tasks including text classification sentiment analysis and machine translation using convolutional and recurrent neural networks.
2,Machine Learning Approaches in Healthcare Diagnosis,Smith J.; Brown A.,Journal of Medical Informatics,2022,machine learning; healthcare; diagnosis; classification; prediction,A comprehensive review of machine learning methods applied in medical diagnosis including decision trees support vector machines and ensemble methods for disease prediction and patient outcome analysis.
3,Convolutional Neural Networks for Image Recognition,Krizhevsky A.; Hinton G.,IEEE Transactions on Pattern Analysis,2020,CNN; image recognition; deep learning; computer vision,This study presents convolutional neural network architectures for large-scale image classification achieving state-of-the-art results on benchmark datasets through innovative layer designs and training techniques.
4,Blockchain Technology in Supply Chain Management,Nakamoto S.; Finney H.,Journal of Operations Management,2021,blockchain; supply chain; distributed ledger; transparency; security,An investigation into how blockchain distributed ledger technology improves supply chain transparency traceability and security across global logistics networks reducing fraud and improving efficiency.
5,Internet of Things Security Challenges and Solutions,Garcia M.; Lopez R.,Journal of Cybersecurity,2022,IoT; security; encryption; vulnerabilities; network,This paper analyzes security vulnerabilities in Internet of Things devices and proposes encryption protocols and authentication frameworks to protect connected devices and networks from cyberattacks.
6,Sentiment Analysis Using Transformer Models,Devlin J.; Chang M.,ACM Transactions on Intelligent Systems,2021,sentiment analysis; BERT; transformers; opinion mining; NLP,We present a sentiment analysis framework using BERT transformer architecture achieving high accuracy on product reviews social media posts and customer feedback classification tasks.
7,Cloud Computing Resource Optimization,Armbrust M.; Fox A.,IEEE Cloud Computing Journal,2020,cloud computing; resource allocation; optimization; virtualization,This research proposes dynamic resource allocation algorithms for cloud computing environments improving performance cost efficiency and scalability through intelligent workload scheduling and virtualization techniques.
8,Federated Learning for Privacy-Preserving AI,McMahan B.; Moore E.,Journal of Privacy and Security,2022,federated learning; privacy; distributed AI; machine learning,Federated learning enables training machine learning models across decentralized devices without sharing raw data preserving user privacy while maintaining model accuracy across healthcare finance and mobile applications.
9,Graph Neural Networks for Social Network Analysis,Kipf T.; Welling M.,Journal of Social Computing,2021,graph neural networks; social networks; node classification; link prediction,Graph neural networks are applied to social network analysis tasks including community detection node classification and link prediction demonstrating superior performance over traditional graph algorithms.
10,Renewable Energy Forecasting Using AI,Johnson P.; Williams K.,Energy Informatics Journal,2022,renewable energy; solar; wind; forecasting; machine learning,Artificial intelligence models including LSTM networks and gradient boosting are applied to forecast solar and wind energy generation improving grid management and reducing dependence on fossil fuels.
11,Cybersecurity Threat Detection with Machine Learning,Anderson R.; Chen L.,Journal of Information Security,2020,cybersecurity; intrusion detection; anomaly detection; deep learning,Machine learning algorithms including autoencoders and random forests are employed for real-time network intrusion detection and malware classification achieving high detection rates with low false positives.
12,Recommender Systems in E-Commerce,Koren Y.; Bell R.,ACM RecSys Journal,2021,recommender systems; collaborative filtering; e-commerce; personalization,This paper reviews collaborative filtering and content-based filtering techniques for e-commerce product recommendation improving customer satisfaction and sales conversion through personalized suggestions.
13,Data Mining Techniques for Student Performance Prediction,Romero C.; Ventura S.,Journal of Educational Technology,2022,data mining; education; student performance; prediction; learning analytics,Educational data mining methods are used to predict student academic performance and dropout risk enabling early intervention strategies to improve learning outcomes and graduation rates.
14,Autonomous Vehicles and Deep Reinforcement Learning,Silver D.; Schrittwieser J.,IEEE Transactions on Robotics,2021,autonomous vehicles; reinforcement learning; self-driving; computer vision,Deep reinforcement learning algorithms are applied to autonomous vehicle navigation combining computer vision LiDAR processing and reward-based training for safe and efficient self-driving in complex environments.
15,Text Summarization Using Sequence-to-Sequence Models,See A.; Liu P.,Computational Linguistics Journal,2020,text summarization; seq2seq; abstractive summarization; NLP; attention,Sequence-to-sequence models with attention mechanisms are developed for abstractive text summarization producing coherent human-readable summaries of long documents news articles and scientific papers.
16,Big Data Analytics in Financial Markets,Lopez J.; Martinez C.,Journal of Financial Technology,2022,big data; financial markets; stock prediction; analytics,Big data processing frameworks including Apache Spark and Hadoop are combined with machine learning for financial market analysis stock price prediction and algorithmic trading strategy development.
17,Computer Vision for Medical Image Analysis,Litjens G.; Kooi T.,Medical Image Analysis Journal,2021,computer vision; medical imaging; segmentation; radiology; deep learning,Deep learning computer vision techniques are applied to medical image segmentation tumor detection and radiology report generation improving diagnostic accuracy and reducing radiologist workload.
18,Smart Agriculture Using IoT and Machine Learning,Liakos K.; Busato P.,Computers and Electronics in Agriculture,2020,smart agriculture; IoT; precision farming; crop prediction; sensors,IoT sensors and machine learning models are integrated for precision agriculture applications including crop yield prediction soil moisture monitoring and automated irrigation improving farm productivity.
19,Natural Language Generation with GPT Models,Brown T.; Mann B.,Journal of Artificial Intelligence,2022,GPT; language generation; transformers; text generation; few-shot learning,Large language models based on GPT architecture demonstrate remarkable natural language generation capabilities through few-shot learning producing coherent essays code summaries and creative content.
20,Quantum Computing Algorithms for Optimization,Preskill J.; Aaronson S.,Physical Review Computing,2021,quantum computing; optimization; quantum algorithms; combinatorial,Quantum algorithms including QAOA and VQE are applied to combinatorial optimization problems demonstrating potential advantages over classical algorithms in supply chain scheduling and drug discovery.
21,Social Media Mining for Public Health Surveillance,Paul M.; Dredze M.,Journal of Biomedical Informatics,2022,social media; public health; surveillance; Twitter; NLP,Social media data mining using NLP techniques enables real-time public health surveillance tracking disease outbreaks mental health trends and vaccine sentiment from Twitter and Reddit posts.
22,Transfer Learning in Computer Vision Applications,Pan S.; Yang Q.,IEEE Transactions on Neural Networks,2020,transfer learning; computer vision; fine-tuning; feature extraction,Transfer learning techniques using pre-trained convolutional networks are applied to small dataset computer vision problems demonstrating effective feature reuse and improved classification performance.
23,Database Optimization and Query Performance,Ramakrishnan R.; Gehrke J.,ACM SIGMOD Journal,2021,database; query optimization; indexing; SQL; performance,Advanced query optimization techniques including adaptive indexing materialized views and cost-based optimization improve database performance for large-scale transactional and analytical workloads.
24,Explainable AI for Medical Decision Support,Doshi-Velez F.; Kim B.,Nature Machine Intelligence,2022,explainable AI; XAI; interpretability; medical; decision support,Explainable artificial intelligence methods including LIME SHAP and attention visualization are applied to medical decision support systems improving clinician trust and regulatory compliance.
25,Edge Computing for Real-Time Data Processing,Shi W.; Cao J.,IEEE Internet of Things Journal,2021,edge computing; real-time; latency; distributed systems; IoT,Edge computing architectures bring data processing closer to IoT devices reducing latency bandwidth consumption and enabling real-time applications in autonomous vehicles smart cities and industrial automation.
